heading,image
"Réfrigérateur 12 V et chargeur à batterie","""https:\/\/www.princecraft.com\/AttachmentImage.ashx?file=OPT-Refrigerator12V.jpg&Size=52&UILanguageID=FR"""
"Chaise longue avant (option Édition Sport)","""https:\/\/www.princecraft.com\/AttachmentImage.ashx?file=STD-Bowlounger-OPT-SportEdition-.jpg&Size=52&UILanguageID=FR"""
"Console conducteur démontrée avec l'écran Simrad® NSX9 et système audio haute-performance optionnel","""https:\/\/www.princecraft.com\/AttachmentImage.ashx?file=STD-Console-OPT-highpowerStereo-.jpg&Size=52&UILanguageID=FR"""
"Insertions de porte-verres avec prise USB dans le rembourrage","""https:\/\/www.princecraft.com\/AttachmentImage.ashx?file=STD-CupholderswithUSB.jpg&Size=52&UILanguageID=FR"""
"Lumières d'accostage à DEL","""https:\/\/www.princecraft.com\/AttachmentImage.ashx?file=STD-Dockinglights-06102022-112430.jpg&Size=52&UILanguageID=FR"""
"Table noire repliable sur poteau amovible, avec porte-verres","""https:\/\/www.princecraft.com\/AttachmentImage.ashx?file=STD-Foldingtable-06102022-143358.jpg&Size=52&UILanguageID=FR"""
"Siège capitaine passager (Option Édition Sport)","""https:\/\/www.princecraft.com\/AttachmentImage.ashx?file=STD-PassengerCaptainChair-OPT-SportEdition-.jpg&Size=52&UILanguageID=FR"""
"Salle d'habillage escamotable","""https:\/\/www.princecraft.com\/AttachmentImage.ashx?file=STD-PrivacyEnclosure-18102023-155436.jpg&Size=52&UILanguageID=FR"""
"Console surélevée de style automobile","""https:\/\/www.princecraft.com\/AttachmentImage.ashx?file=STD-Raisedhelm.jpg&Size=52&UILanguageID=FR"""
"Arrière du modèle XT avec mât de remorquage en acier inoxydable noir intégré","""https:\/\/www.princecraft.com\/AttachmentImage.ashx?file=STD-VogueXT-SkiBar-06102022-112837.jpg&Size=52&UILanguageID=FR"""
