heading,image
"Table à goûter (Ensemble Ambiance)","""https:\/\/www.princecraft.com\/AttachmentImage.ashx?file=OPT-BowTable-moodpack-.jpg&Size=52&UILanguageID=FR"""
"Double auvent bimini offert en option","""https:\/\/www.princecraft.com\/AttachmentImage.ashx?file=OPT-DoubleBimin.jpg&Size=52&UILanguageID=FR"""
"Éclairage à DEL sous la console conducteur et le mobilier","""https:\/\/www.princecraft.com\/AttachmentImage.ashx?file=OPT-LED-Editions-.jpg&Size=52&UILanguageID=FR"""
"Coffre à gants dans la console, inclus dans l'option Ensemble Ambiance","""https:\/\/www.princecraft.com\/AttachmentImage.ashx?file=OPT-Moodpack-in-dashcubby--28102020-123702.jpg&Size=52&UILanguageID=FR"""
"Mât de remorquage amovible","""https:\/\/www.princecraft.com\/AttachmentImage.ashx?file=OPT-RemovableSkiPost.jpg&Size=52&UILanguageID=FR"""
"Écran multifonctions Simrad® NSX7 optionnel avec instrumentation","""https:\/\/www.princecraft.com\/AttachmentImage.ashx?file=OPT-SimradGo7.jpg&Size=52&UILanguageID=FR"""
"Console conducteur rotomoulée","""https:\/\/www.princecraft.com\/AttachmentImage.ashx?file=STD-Driverhelm.jpg&Size=52&UILanguageID=FR"""
"Aménagement RL avec dossier ajustable 2 positions","""https:\/\/www.princecraft.com\/AttachmentImage.ashx?file=STD-RLlounger.jpg&Size=52&UILanguageID=FR"""
"Aire de bronzage avec dossier ajustable 2 positions","""https:\/\/www.princecraft.com\/AttachmentImage.ashx?file=STD-RLlounger2.jpg&Size=52&UILanguageID=FR"""
"Table à goûter de grande dimension","""https:\/\/www.princecraft.com\/AttachmentImage.ashx?file=STD-RLTable.jpg&Size=52&UILanguageID=FR"""
